[
  {
    "step": 98,
    "type": "PAYMENT",
    "amount": 81965.85,
    "nameOrig": "C4202007852",
    "oldbalanceOrg": 428658.79,
    "newbalanceOrig": 346692.94,
    "nameDest": "M8534283164",
    "oldbalanceDest": 0.0,
    "newbalanceDest": 0.0,
    "isFraud": 0,
    "isFlaggedFraud": 0
  },
  {
    "step": 419,
    "type": "DEBIT",
    "amount": 3284.8,
    "nameOrig": "C624518482",
    "oldbalanceOrg": 473453.37,
    "newbalanceOrig": 470168.57,
    "nameDest": "C386652427",
    "oldbalanceDest": 589156.48,
    "newbalanceDest": 589156.48,
    "isFraud": 0,
    "isFlaggedFraud": 0
  },
  {
    "step": 327,
    "type": "CASH_OUT",
    "amount": 44477.32,
    "nameOrig": "C7129608940",
    "oldbalanceOrg": 539939.62,
    "newbalanceOrig": 495462.3,
    "nameDest": "C5982655425",
    "oldbalanceDest": 482960.77,
    "newbalanceDest": 482960.77,
    "isFraud": 0,
    "isFlaggedFraud": 0
  },
  {
    "step": 105,
    "type": "TRANSFER",
    "amount": 183454.72,
    "nameOrig": "C1529441694",
    "oldbalanceOrg": 403253.78,
    "newbalanceOrig": 219799.06,
    "nameDest": "C515765066",
    "oldbalanceDest": 143972.48,
    "newbalanceDest": 327427.2,
    "isFraud": 0,
    "isFlaggedFraud": 0
  },
  {
    "step": 397,
    "type": "CASH_IN",
    "amount": 35433.86,
    "nameOrig": "C9866114420",
    "oldbalanceOrg": 99875.17,
    "newbalanceOrig": 135309.03,
    "nameDest": "C2478318769",
    "oldbalanceDest": 598676.46,
    "newbalanceDest": 598676.46,
    "isFraud": 0,
    "isFlaggedFraud": 0
  },
  {
    "step": 528,
    "type": "CASH_OUT",
    "amount": 13397.35,
    "nameOrig": "C9515926319",
    "oldbalanceOrg": 232541.11,
    "newbalanceOrig": 219143.76,
    "nameDest": "C3292606527",
    "oldbalanceDest": 879044.05,
    "newbalanceDest": 879044.05,
    "isFraud": 0,
    "isFlaggedFraud": 0
  },
  {
    "step": 644,
    "type": "DEBIT",
    "amount": 17872.48,
    "nameOrig": "C2786498947",
    "oldbalanceOrg": 93574.46,
    "newbalanceOrig": 75701.98,
    "nameDest": "C9156473181",
    "oldbalanceDest": 159952.97,
    "newbalanceDest": 159952.97,
    "isFraud": 0,
    "isFlaggedFraud": 0
  },
  {
    "step": 139,
    "type": "CASH_OUT",
    "amount": 56620.11,
    "nameOrig": "C1449400777",
    "oldbalanceOrg": 259169.9,
    "newbalanceOrig": 202549.79,
    "nameDest": "C9512429960",
    "oldbalanceDest": 742197.17,
    "newbalanceDest": 742197.17,
    "isFraud": 0,
    "isFlaggedFraud": 0
  },
  {
    "step": 154,
    "type": "PAYMENT",
    "amount": 3943.42,
    "nameOrig": "C1809756677",
    "oldbalanceOrg": 309870.58,
    "newbalanceOrig": 305927.16,
    "nameDest": "M1832902945",
    "oldbalanceDest": 0.0,
    "newbalanceDest": 0.0,
    "isFraud": 0,
    "isFlaggedFraud": 0
  },
  {
    "step": 135,
    "type": "PAYMENT",
    "amount": 59292.62,
    "nameOrig": "C8147195564",
    "oldbalanceOrg": 444590.44,
    "newbalanceOrig": 385297.82,
    "nameDest": "M3836956614",
    "oldbalanceDest": 0.0,
    "newbalanceDest": 0.0,
    "isFraud": 0,
    "isFlaggedFraud": 0
  },
  {
    "step": 534,
    "type": "CASH_OUT",
    "amount": 23036.9,
    "nameOrig": "C352995155",
    "oldbalanceOrg": 346688.26,
    "newbalanceOrig": 323651.36,
    "nameDest": "C2775821645",
    "oldbalanceDest": 960935.06,
    "newbalanceDest": 960935.06,
    "isFraud": 0,
    "isFlaggedFraud": 0
  },
  {
    "step": 338,
    "type": "CASH_IN",
    "amount": 20704.02,
    "nameOrig": "C597870476",
    "oldbalanceOrg": 110997.52,
    "newbalanceOrig": 131701.54,
    "nameDest": "C4307882843",
    "oldbalanceDest": 535082.34,
    "newbalanceDest": 535082.34,
    "isFraud": 0,
    "isFlaggedFraud": 0
  },
  {
    "step": 262,
    "type": "PAYMENT",
    "amount": 10571.86,
    "nameOrig": "C642719046",
    "oldbalanceOrg": 156197.73,
    "newbalanceOrig": 145625.87,
    "nameDest": "M9344692029",
    "oldbalanceDest": 0.0,
    "newbalanceDest": 0.0,
    "isFraud": 0,
    "isFlaggedFraud": 0
  },
  {
    "step": 265,
    "type": "TRANSFER",
    "amount": 107988.63,
    "nameOrig": "C7019147117",
    "oldbalanceOrg": 253877.75,
    "newbalanceOrig": 145889.12,
    "nameDest": "C4358758010",
    "oldbalanceDest": 44076.72,
    "newbalanceDest": 152065.35,
    "isFraud": 0,
    "isFlaggedFraud": 0
  },
  {
    "step": 680,
    "type": "TRANSFER",
    "amount": 23906.01,
    "nameOrig": "C5718580646",
    "oldbalanceOrg": 352781.31,
    "newbalanceOrig": 328875.3,
    "nameDest": "C8153237964",
    "oldbalanceDest": 570735.38,
    "newbalanceDest": 594641.39,
    "isFraud": 0,
    "isFlaggedFraud": 0
  },
  {
    "step": 368,
    "type": "PAYMENT",
    "amount": 82838.49,
    "nameOrig": "C2883034565",
    "oldbalanceOrg": 559567.59,
    "newbalanceOrig": 476729.1,
    "nameDest": "M9171428421",
    "oldbalanceDest": 0.0,
    "newbalanceDest": 0.0,
    "isFraud": 0,
    "isFlaggedFraud": 0
  },
  {
    "step": 257,
    "type": "CASH_IN",
    "amount": 10076.52,
    "nameOrig": "C9307341196",
    "oldbalanceOrg": 215244.24,
    "newbalanceOrig": 225320.76,
    "nameDest": "C2931658225",
    "oldbalanceDest": 36303.79,
    "newbalanceDest": 36303.79,
    "isFraud": 0,
    "isFlaggedFraud": 0
  },
  {
    "step": 237,
    "type": "CASH_IN",
    "amount": 15745.94,
    "nameOrig": "C2466597419",
    "oldbalanceOrg": 283397.14,
    "newbalanceOrig": 299143.08,
    "nameDest": "C6059938509",
    "oldbalanceDest": 265126.25,
    "newbalanceDest": 265126.25,
    "isFraud": 0,
    "isFlaggedFraud": 0
  },
  {
    "step": 134,
    "type": "DEBIT",
    "amount": 62071.34,
    "nameOrig": "C2063329093",
    "oldbalanceOrg": 394598.62,
    "newbalanceOrig": 332527.28,
    "nameDest": "C6737876654",
    "oldbalanceDest": 306475.83,
    "newbalanceDest": 306475.83,
    "isFraud": 0,
    "isFlaggedFraud": 0
  },
  {
    "step": 598,
    "type": "CASH_IN",
    "amount": 62695.32,
    "nameOrig": "C4643746116",
    "oldbalanceOrg": 102669.73,
    "newbalanceOrig": 165365.05,
    "nameDest": "C8546053887",
    "oldbalanceDest": 309445.9,
    "newbalanceDest": 309445.9,
    "isFraud": 0,
    "isFlaggedFraud": 0
  },
  {
    "step": 416,
    "type": "PAYMENT",
    "amount": 190511.74,
    "nameOrig": "C4482635678",
    "oldbalanceOrg": 429381.16,
    "newbalanceOrig": 238869.42,
    "nameDest": "M5266309777",
    "oldbalanceDest": 0.0,
    "newbalanceDest": 0.0,
    "isFraud": 0,
    "isFlaggedFraud": 0
  },
  {
    "step": 521,
    "type": "CASH_OUT",
    "amount": 11113.52,
    "nameOrig": "C3491220609",
    "oldbalanceOrg": 508002.15,
    "newbalanceOrig": 496888.63,
    "nameDest": "C3375007846",
    "oldbalanceDest": 306671.14,
    "newbalanceDest": 306671.14,
    "isFraud": 0,
    "isFlaggedFraud": 0
  },
  {
    "step": 331,
    "type": "CASH_IN",
    "amount": 101578.84,
    "nameOrig": "C1256108623",
    "oldbalanceOrg": 256908.58,
    "newbalanceOrig": 358487.42,
    "nameDest": "C1942101692",
    "oldbalanceDest": 484750.94,
    "newbalanceDest": 484750.94,
    "isFraud": 0,
    "isFlaggedFraud": 0
  },
  {
    "step": 503,
    "type": "CASH_IN",
    "amount": 406262.33,
    "nameOrig": "C1080972470",
    "oldbalanceOrg": 13120.94,
    "newbalanceOrig": 419383.27,
    "nameDest": "C5708917385",
    "oldbalanceDest": 436396.53,
    "newbalanceDest": 436396.53,
    "isFraud": 0,
    "isFlaggedFraud": 0
  },
  {
    "step": 128,
    "type": "CASH_OUT",
    "amount": 44924.22,
    "nameOrig": "C4108488047",
    "oldbalanceOrg": 175726.2,
    "newbalanceOrig": 130801.98,
    "nameDest": "C9686855520",
    "oldbalanceDest": 816457.32,
    "newbalanceDest": 816457.32,
    "isFraud": 0,
    "isFlaggedFraud": 0
  },
  {
    "step": 625,
    "type": "CASH_IN",
    "amount": 2610.02,
    "nameOrig": "C3863532825",
    "oldbalanceOrg": 358912.62,
    "newbalanceOrig": 361522.64,
    "nameDest": "C9052234481",
    "oldbalanceDest": 559028.69,
    "newbalanceDest": 559028.69,
    "isFraud": 0,
    "isFlaggedFraud": 0
  },
  {
    "step": 207,
    "type": "CASH_OUT",
    "amount": 9339.95,
    "nameOrig": "C4843476356",
    "oldbalanceOrg": 362220.72,
    "newbalanceOrig": 352880.77,
    "nameDest": "C1755122844",
    "oldbalanceDest": 202438.77,
    "newbalanceDest": 202438.77,
    "isFraud": 0,
    "isFlaggedFraud": 0
  },
  {
    "step": 28,
    "type": "DEBIT",
    "amount": 137973.8,
    "nameOrig": "C1618172870",
    "oldbalanceOrg": 322488.38,
    "newbalanceOrig": 184514.58,
    "nameDest": "C9436876535",
    "oldbalanceDest": 441339.68,
    "newbalanceDest": 441339.68,
    "isFraud": 0,
    "isFlaggedFraud": 0
  },
  {
    "step": 379,
    "type": "CASH_IN",
    "amount": 26646.55,
    "nameOrig": "C8503432303",
    "oldbalanceOrg": 492979.34,
    "newbalanceOrig": 519625.89,
    "nameDest": "C6625112366",
    "oldbalanceDest": 375527.27,
    "newbalanceDest": 375527.27,
    "isFraud": 0,
    "isFlaggedFraud": 0
  },
  {
    "step": 262,
    "type": "CASH_IN",
    "amount": 48987.61,
    "nameOrig": "C969165204",
    "oldbalanceOrg": 259343.91,
    "newbalanceOrig": 308331.52,
    "nameDest": "C1662779558",
    "oldbalanceDest": 997407.43,
    "newbalanceDest": 997407.43,
    "isFraud": 0,
    "isFlaggedFraud": 0
  },
  {
    "step": 123,
    "type": "TRANSFER",
    "amount": 156513.63,
    "nameOrig": "C3213783504",
    "oldbalanceOrg": 306244.94,
    "newbalanceOrig": 149731.31,
    "nameDest": "C7320766608",
    "oldbalanceDest": 295191.72,
    "newbalanceDest": 451705.35,
    "isFraud": 0,
    "isFlaggedFraud": 0
  },
  {
    "step": 334,
    "type": "PAYMENT",
    "amount": 70221.23,
    "nameOrig": "C5615937354",
    "oldbalanceOrg": 95936.14,
    "newbalanceOrig": 25714.91,
    "nameDest": "M2937860916",
    "oldbalanceDest": 0.0,
    "newbalanceDest": 0.0,
    "isFraud": 0,
    "isFlaggedFraud": 0
  },
  {
    "step": 100,
    "type": "CASH_IN",
    "amount": 5679.5,
    "nameOrig": "C4482990273",
    "oldbalanceOrg": 221841.84,
    "newbalanceOrig": 227521.34,
    "nameDest": "C9597385566",
    "oldbalanceDest": 993156.62,